{
  "contract_version": "chicago-k2-production-audit/v1",
  "audit_name": "deterministic-synthetic-cross-midnight-fixture",
  "input": {
    "dataset_id": "6dvr-xwnh",
    "snapshot_revision_fingerprint_sha256": "aaaaaaaaaaaaaaaaaaaaaaaaaaaaaaaaaaaaaaaaaaaaaaaaaaaaaaaaaaaaaaaa",
    "expected_row_count": 16,
    "expected_input_sha256": "27c073b275fd5fc94e5e27ee48bee89a4a07bc1b42e63749c7d131f0639f9a10",
    "input_hash_basis": "canonical_json_rows_v1",
    "server_count_verified": true,
    "snapshot_stable_during_extraction": true,
    "selection_scope": "all_public_rows_in_released_start_window_plus_null_start_evidence",
    "null_start_scope": "server_verified_zero_literal_match_true_k2_null_start_rows",
    "server_target_like_null_start_row_count": 0,
    "null_start_count_evidence_sha256": "ffffffffffffffffffffffffffffffffffffffffffffffffffffffffffffffff",
    "raw_identifiers_in_report": false
  },
  "window": {
    "core_start_local": "2026-01-13T00:00:00",
    "core_end_local": "2026-01-14T00:00:00",
    "extraction_start_local": "2026-01-12T22:00:00",
    "extraction_end_local": "2026-01-14T02:00:00",
    "core_anchor": "released_trip_start_timestamp"
  },
  "timestamp_release": {
    "rounding_minutes": 15,
    "interpretation": "nearest_with_closed_outer_interval"
  },
  "run_closure": {
    "maximum_transaction_duration_minutes": 90,
    "duration_bound_basis": "analyst_assumption",
    "duration_bound_evidence": {
      "authority": "analyst",
      "effective_scope": "sensitivity_only",
      "artifact_sha256": "bbbbbbbbbbbbbbbbbbbbbbbbbbbbbbbbbbbbbbbbbbbbbbbbbbbbbbbbbbbbbbbb"
    },
    "public_shared_trip_id_available": false
  },
  "candidate_graph": {
    "logical_rules": [
      "both_endpoints_have_literal_match_true_and_integer_trips_pooled_2",
      "at_least_one_endpoint_has_core_role",
      "possible_closed_interval_overlap_after_timestamp_rounding"
    ],
    "missing_timestamp_policy": "retain_indeterminate",
    "max_materialized_logical_edges": 10000,
    "exact_fallback_max_core_nodes": 28,
    "exact_fallback_max_edges": 10000,
    "feasibility_time_limit_seconds": 5,
    "heuristics": {
      "pickup_radius_km": 5,
      "dropoff_radius_km": null,
      "direction_cosine_min": null,
      "per_node_degree_cap": null,
      "missing_spatial_policy": "retain"
    }
  },
  "columns": {
    "trip_id": "trip_id",
    "trip_start_timestamp": "trip_start_timestamp",
    "trip_end_timestamp": "trip_end_timestamp",
    "shared_trip_authorized": "shared_trip_authorized",
    "shared_trip_match": "shared_trip_match",
    "trips_pooled": "trips_pooled",
    "pickup_latitude": "pickup_centroid_latitude",
    "pickup_longitude": "pickup_centroid_longitude",
    "dropoff_latitude": "dropoff_centroid_latitude",
    "dropoff_longitude": "dropoff_centroid_longitude"
  }
}
